{"schema_version":"archfit.agent-result.v1","verdict":"needs_attention","next_action":"none","summary":"needs_attention: change pass, 0 blockers, 0 existing; 0 unknown rules, 0 evidence gaps; 1 attention","identity":{"schema_version":"archfit.result-identity.v1","policy_digest":"aaaaaaaaaaaaaaaaaaaaaaaaaaaaaaaaaaaaaaaaaaaaaaaaaaaaaaaaaaaaaaaa","baseline_digest":"bbbbbbbbbbbbbbbbbbbbbbbbbbbbbbbbbbbbbbbbbbbbbbbbbbbbbbbbbbbbbbbb","labels_digest":"cccccccccccccccccccccccccccccccccccccccccccccccccccccccccccccccc","base_sha":"dddddddddddddddddddddddddddddddddddddddd","head_tree_digest":"eeeeeeeeeeeeeeeeeeeeeeeeeeeeeeeeeeeeeeee","engine_version":"v0.0.0-test","measurement_profile_hash":"ffffffffffffffffffffffffffffffffffffffffffffffffffffffffffffffff"},"change":{"status":"pass","blockers":[],"evidence_gaps":[],"unevaluated_rules":[]},"repository":{"attention":[{"kind":"unmeasured_ratchet","rule_ids":["rule_0"],"reason":"reference not comparable (drift: measurement_profile): 3 metric ratchets cannot be evaluated"}]},"omitted":{"blockers":0,"unevaluated_rules":0,"attention":0,"advisories":0}}
