{"schema_version":"archfit.agent-result.v1","verdict":"blocked","next_action":"repair","summary":"blocked: change fail, 1 blockers, 0 existing; 0 unknown rules, 0 evidence gaps; 0 attention","identity":{"schema_version":"archfit.result-identity.v1","policy_digest":"aaaaaaaaaaaaaaaaaaaaaaaaaaaaaaaaaaaaaaaaaaaaaaaaaaaaaaaaaaaaaaaa","baseline_digest":"bbbbbbbbbbbbbbbbbbbbbbbbbbbbbbbbbbbbbbbbbbbbbbbbbbbbbbbbbbbbbbbb","labels_digest":"cccccccccccccccccccccccccccccccccccccccccccccccccccccccccccccccc","base_sha":"dddddddddddddddddddddddddddddddddddddddd","head_tree_digest":"eeeeeeeeeeeeeeeeeeeeeeeeeeeeeeeeeeeeeeee","engine_version":"v0.0.0-test","measurement_profile_hash":"ffffffffffffffffffffffffffffffffffffffffffffffffffffffffffffffff"},"change":{"status":"fail","blockers":[{"finding_ids":["d4"],"rule_ids":["no_x"],"repair_kind":"code_change","origin":"introduced","in_scope":true,"severity":"high","edge":{"from":"internal/a/a.go","to":"internal/b","kind":"imports"},"at":[{"file":"internal/a/a.go","line":5}],"goal":"Remove the forbidden dependency from internal/a/a.go on internal/b.","constraints":["constraint of no_x"],"edit":["internal/a/a.go"]}],"evidence_gaps":[],"unevaluated_rules":[]},"repository":{"attention":[]},"omitted":{"blockers":0,"unevaluated_rules":0,"attention":0,"advisories":0},"validate":"archfit check -c .archfit.yaml --require-tools --format agent"}
