{"schema_version":"archfit.agent-result.v1","verdict":"blocked","next_action":"none","summary":"blocked: change pass, 0 blockers, 1 existing; 0 unknown rules, 0 evidence gaps; 1 attention","identity":{"schema_version":"archfit.result-identity.v1","policy_digest":"aaaaaaaaaaaaaaaaaaaaaaaaaaaaaaaaaaaaaaaaaaaaaaaaaaaaaaaaaaaaaaaa","baseline_digest":"bbbbbbbbbbbbbbbbbbbbbbbbbbbbbbbbbbbbbbbbbbbbbbbbbbbbbbbbbbbbbbbb","labels_digest":"cccccccccccccccccccccccccccccccccccccccccccccccccccccccccccccccc","base_sha":"dddddddddddddddddddddddddddddddddddddddd","head_tree_digest":"eeeeeeeeeeeeeeeeeeeeeeeeeeeeeeeeeeeeeeee","engine_version":"v0.0.0-test","measurement_profile_hash":"ffffffffffffffffffffffffffffffffffffffffffffffffffffffffffffffff"},"change":{"status":"pass","blockers":[],"evidence_gaps":[],"unevaluated_rules":[]},"repository":{"attention":[{"kind":"existing_violation","rule_ids":["no_x"],"count":1,"reason":"blockers that exist at the base; this change did not add them"}]},"omitted":{"blockers":0,"unevaluated_rules":0,"attention":0,"advisories":0},"validate":"archfit check -c .archfit.yaml --require-tools --format agent"}
