{"schema_version":"archfit.agent-result.v1","verdict":"needs_attention","next_action":"restore_evidence","summary":"needs_attention: change unknown, 0 blockers, 0 existing; 1 unknown rules, 0 evidence gaps; 0 attention","identity":{"schema_version":"archfit.result-identity.v1","policy_digest":"aaaaaaaaaaaaaaaaaaaaaaaaaaaaaaaaaaaaaaaaaaaaaaaaaaaaaaaaaaaaaaaa","baseline_digest":"bbbbbbbbbbbbbbbbbbbbbbbbbbbbbbbbbbbbbbbbbbbbbbbbbbbbbbbbbbbbbbbb","labels_digest":"cccccccccccccccccccccccccccccccccccccccccccccccccccccccccccccccc","base_sha":"dddddddddddddddddddddddddddddddddddddddd","head_tree_digest":"eeeeeeeeeeeeeeeeeeeeeeeeeeeeeeeeeeeeeeee","engine_version":"v0.0.0-test","measurement_profile_hash":"ffffffffffffffffffffffffffffffffffffffffffffffffffffffffffffffff"},"change":{"status":"unknown","blockers":[],"evidence_gaps":[],"unevaluated_rules":[{"rule_id":"rule_0","reason":"go/packages evidence is partial"}]},"repository":{"attention":[]},"omitted":{"blockers":0,"unevaluated_rules":0,"attention":0,"advisories":0}}
